<Database Version="2" DatabaseName="SpedHubDB" xmlns:xsi="http://www.w3.org/2001/XMLSchema-instance" xsi:noNamespaceSchemaLocation="Configuration/Database.xsd">
  <GenerationOptions>
    <AlignClauseBodies>true</AlignClauseBodies>
    <AlignColumnDefinitionFields>true</AlignColumnDefinitionFields>
    <AlignSetClauseItem>true</AlignSetClauseItem>
    <AsKeywordOnOwnLine>true</AsKeywordOnOwnLine>
    <IncludeSemicolons>true</IncludeSemicolons>
    <IndentationSize>4</IndentationSize>
    <IndentSetClause>true</IndentSetClause>
    <IndentViewBody>true</IndentViewBody>
    <KeywordCasing>Uppercase</KeywordCasing>
    <MultilineInsertSourcesList>true</MultilineInsertSourcesList>
    <MultilineInsertTargetsList>true</MultilineInsertTargetsList>
    <MultilineSelectElementsList>true</MultilineSelectElementsList>
    <MultilineSetClauseItems>true</MultilineSetClauseItems>
    <MultilineViewColumnsList>true</MultilineViewColumnsList>
    <MultilineWherePredicatesList>true</MultilineWherePredicatesList>
    <NewLineBeforeCloseParenthesisInMultilineList>true</NewLineBeforeCloseParenthesisInMultilineList>
    <NewLineBeforeFromClause>true</NewLineBeforeFromClause>
    <NewLineBeforeGroupByClause>true</NewLineBeforeGroupByClause>
    <NewLineBeforeHavingClause>true</NewLineBeforeHavingClause>
    <NewLineBeforeJoinClause>true</NewLineBeforeJoinClause>
    <NewLineBeforeOffsetClause>true</NewLineBeforeOffsetClause>
    <NewLineBeforeOpenParenthesisInMultilineList>true</NewLineBeforeOpenParenthesisInMultilineList>
    <NewLineBeforeOrderByClause>true</NewLineBeforeOrderByClause>
    <NewLineBeforeOutputClause>true</NewLineBeforeOutputClause>
    <NewLineBeforeWhereClause>true</NewLineBeforeWhereClause>
    <SqlVersion>Sql150</SqlVersion>
  </GenerationOptions>
  <Schemas>
    <Schema Name="dbo" DbDefault="1" />
    <Schema Name="guest" DbDefault="1" />
    <Schema Name="db_owner" DbDefault="1" />
    <Schema Name="db_accessadmin" DbDefault="1" />
    <Schema Name="db_securityadmin" DbDefault="1" />
    <Schema Name="db_ddladmin" DbDefault="1" />
    <Schema Name="db_backupoperator" DbDefault="1" />
    <Schema Name="db_datareader" DbDefault="1" />
    <Schema Name="db_datawriter" DbDefault="1" />
    <Schema Name="db_denydatareader" DbDefault="1" />
    <Schema Name="db_denydatawriter" DbDefault="1" />
  </Schemas>
  <Tables>
    <Table Schema="dbo" Name="CaseManager">
      <Columns>
        <Column Name="ID" IsIdentity="1" IdentitySeed="1" IdentityIncrement="1" DataType="INT" />
        <Column Name="FirstName" DataType="VARCHAR(MAX)" AllowNulls="0" />
        <Column Name="MiddleName" DataType="VARCHAR(MAX)" AllowNulls="1" />
        <Column Name="LastName" DataType="VARCHAR(MAX)" AllowNulls="0" />
      </Columns>
      <Indexes>
        <Index Name="PK_CaseManager_ID" IsPrimary="1" IsClustered="1" IsUnique="1">
          <Members>
            <Member Column="ID" />
          </Members>
        </Index>
      </Indexes>
    </Table>
    <Table Schema="dbo" Name="EducationPlan">
      <Columns>
        <Column Name="ID" IsIdentity="1" IdentitySeed="1" IdentityIncrement="1" DataType="INT" />
        <Column Name="ValidStart" DataType="DATETIME" AllowNulls="0"/>
        <Column Name="ValidEnd" DataType="DATETIME" AllowNulls="0"/>
      </Columns>
      <Indexes>
        <Index Name="PK_EducationPlan_ID" IsPrimary="1" IsClustered="1" IsUnique="1">
          <Members>
            <Member Column="ID" />
          </Members>
        </Index>
      </Indexes>
    </Table>
    <Table Schema="dbo" Name="Accommodation">
      <Columns>
        <Column Name="ID" IsIdentity="1" IdentitySeed="1" IdentityIncrement="1" DataType="INT" />
        <Column Name="Description" DataType="VARCHAR(MAX)"/>
        <Column Name="Category" DataType="VARCHAR(MAX)"/>
      </Columns>
      <Indexes>
        <Index Name="PK_Accommodation_ID" IsPrimary="1" IsClustered="1" IsUnique="1">
          <Members>
            <Member Column="ID" />
          </Members>
        </Index>
      </Indexes>
    </Table>
    <Table Schema="dbo" Name="Subject">
      <Columns>
        <Column Name="ID" IsIdentity="1" IdentitySeed="1" IdentityIncrement="1" DataType="INT" />
        <Column Name="Description" DataType="VARCHAR(MAX)" AllowNulls="0"/>
      </Columns>
      <Indexes>
        <Index Name="PK_Subject_ID" IsPrimary="1" IsClustered="1" IsUnique="1">
          <Members>
            <Member Column="ID" />
          </Members>
        </Index>
      </Indexes>
    </Table>
    <Table Schema="dbo" Name="AccommodationReference">
      <Columns>
        <Column Name="ID" IsIdentity="1" IdentitySeed="1" IdentityIncrement="1" DataType="INT" />
        <Column Name="EducationPlanID" DataType="INT" AllowNulls="1" />
        <Column Name="AccommodationID" DataType="INT" AllowNulls="1" />
      </Columns>
      <Indexes>
        <Index Name="PK_AccommodationReference_ID" IsPrimary="1" IsClustered="1" IsUnique="1">
          <Members>
            <Member Column="ID" />
          </Members>
        </Index>
      </Indexes>
      <ForeignKeys>
        <ForeignKey Name="FK_AccommodationReference_EducationPlanID" PkTableSchema="dbo" PkTable="EducationPlan">
          <ForeignKeyColumns>
            <ForeignKeyColumn FkColumn="EducationPlanID" PkColumn="ID" />
          </ForeignKeyColumns>
        </ForeignKey>
        <ForeignKey Name="FK_AccommodationReference_AccommodationID" PkTableSchema="dbo" PkTable="Accommodation">
          <ForeignKeyColumns>
            <ForeignKeyColumn FkColumn="AccommodationID" PkColumn="ID" />
          </ForeignKeyColumns>
        </ForeignKey>
      </ForeignKeys>
    </Table>
    <Table Schema="dbo" Name="SubjectReference">
      <Columns>
        <Column Name="ID" IsIdentity="1" IdentitySeed="1" IdentityIncrement="1" DataType="INT" />
        <Column Name="AccommodationReferenceID" DataType="INT" AllowNulls="1" />
        <Column Name="SubjectID" DataType="INT" AllowNulls="1" />
      </Columns>
      <Indexes>
        <Index Name="PK_SubjectReference_ID" IsPrimary="1" IsClustered="1" IsUnique="1">
          <Members>
            <Member Column="ID" />
          </Members>
        </Index>
      </Indexes>
      <ForeignKeys>
        <ForeignKey Name="FK_SubjectReference_AccommodationReferenceID" PkTableSchema="dbo" PkTable="AccommodationReference">
          <ForeignKeyColumns>
            <ForeignKeyColumn FkColumn="AccommodationReferenceID" PkColumn="ID" />
          </ForeignKeyColumns>
        </ForeignKey>
        <ForeignKey Name="FK_SubjectReference_SubjectID" PkTableSchema="dbo" PkTable="Subject">
          <ForeignKeyColumns>
            <ForeignKeyColumn FkColumn="SubjectID" PkColumn="ID" />
          </ForeignKeyColumns>
        </ForeignKey>
      </ForeignKeys>
    </Table>
    <Table Schema="dbo" Name="PresentLevel">
      <Columns>
        <Column Name="ID" IsIdentity="1" IdentitySeed="1" IdentityIncrement="1" DataType="INT" />
        <Column Name="EducationPlanID" DataType="INT" AllowNulls="1" />
        <Column Name="Subject" DataType="VARCHAR(MAX)"/>
        <Column Name="Statement" DataType="TEXT"/>
      </Columns>
      <Indexes>
        <Index Name="PK_PresentLevel_ID" IsPrimary="1" IsClustered="1" IsUnique="1">
          <Members>
            <Member Column="ID" />
          </Members>
        </Index>
      </Indexes>
      <ForeignKeys>
        <ForeignKey Name="FK_PresentLevel_EducationPlanID" PkTableSchema="dbo" PkTable="EducationPlan">
          <ForeignKeyColumns>
            <ForeignKeyColumn FkColumn="EducationPlanID" PkColumn="ID" />
          </ForeignKeyColumns>
        </ForeignKey>
      </ForeignKeys>
    </Table>
    <Table Schema="dbo" Name="Student">
      <Columns>
        <Column Name="ID" IsIdentity="1" IdentitySeed="1" IdentityIncrement="1" DataType="INT" />
        <Column Name="CaseManagerID" DataType="INT" AllowNulls="1" />
        <Column Name="FirstName" DataType="VARCHAR(MAX)" AllowNulls="0" />
        <Column Name="MiddleName" DataType="VARCHAR(MAX)" AllowNulls="1" />
        <Column Name="LastName" DataType="VARCHAR(MAX)" AllowNulls="0" />
        <Column Name="DateOfBirth" DataType="DATETIME" AllowNulls="1"/>
        <Column Name="Gender" DataType="BIT" AllowNulls="0" />
        <Column Name="GradeLevel" DataType="INT" AllowNulls="0"/>
      </Columns>
      <Indexes>
        <Index Name="PK_Student_ID" IsPrimary="1" IsClustered="1" IsUnique="1">
          <Members>
            <Member Column="ID" />
          </Members>
        </Index>
      </Indexes>
      <ForeignKeys>
        <ForeignKey Name="FK_Student_CaseManagerID" PkTableSchema="dbo" PkTable="CaseManager">
          <ForeignKeyColumns>
            <ForeignKeyColumn FkColumn="CaseManagerID" PkColumn="ID" />
          </ForeignKeyColumns>
        </ForeignKey>
      </ForeignKeys>
    </Table>

  </Tables>
</Database>